review_text,sentiment_label,sentiment_score,identified_theme
"you guys keep on releasing unstable app, now it won't login",NEGATIVE,0.9805342555046082,"Account Access Issues, Feature Requests, User Interface & Experience, Transaction Performance, Customer Support"
Doeisn't work,NEGATIVE,0.9996792078018188,"Account Access Issues, Feature Requests, User Interface & Experience, Transaction Performance, Customer Support"
"I never ever seen the worst commercial app like this in my life , it does not work anything , i donot know how the IT Team of the bank tested and launch the app. Its annoying !",NEGATIVE,0.9997454285621643,"Account Access Issues, Feature Requests, User Interface & Experience, Transaction Performance, Customer Support"
The best bank with the worst application and ussd service.,NEGATIVE,0.9984097480773926,"Account Access Issues, Feature Requests, User Interface & Experience, Transaction Performance, Customer Support"
The old version is best. This one is so lagging and it's not fast to quick transfer,NEGATIVE,0.8973873257637024,"Account Access Issues, Feature Requests, User Interface & Experience, Transaction Performance, Customer Support"
The latest update has a bug it keeps crashing. Please fix it it's so inconvenient to do our business this way. That or we will switch to other banks,NEGATIVE,0.999640703201294,"Account Access Issues, Feature Requests, User Interface & Experience, Transaction Performance, Customer Support"
Amaizing Bank in Etthiopia,POSITIVE,0.5923478603363037,"Account Access Issues, Feature Requests, User Interface & Experience, Transaction Performance, Customer Support"
Good banking app,POSITIVE,0.999841570854187,"Account Access Issues, Feature Requests, User Interface & Experience, Transaction Performance, Customer Support"
It doesn't function properly!! You don't even deserve one star.. please stop playing your dirty game on your customer...,NEGATIVE,0.9997984766960144,"Account Access Issues, Feature Requests, User Interface & Experience, Transaction Performance, Customer Support"
That's a fantastic app! L,POSITIVE,0.9998694658279419,"Account Access Issues, Feature Requests, User Interface & Experience, Transaction Performance, Customer Support"
The best bank,POSITIVE,0.9998573064804077,"Account Access Issues, Feature Requests, User Interface & Experience, Transaction Performance, Customer Support"
"This app has been found useless while I compared with the first version of IB12111...that was very good, you guys what is the matter with you. You are far from the technology and the competetor's digital product through convenience, reliable, easeness _-dashen, cbe, zemen... they are doing well! share their experience and be able to satisfy your esteemed customers including me. unless you will be down soon!",NEGATIVE,0.9895106554031372,"Account Access Issues, Feature Requests, User Interface & Experience, Transaction Performance, Customer Support"
"This new update really sucks.. Can't even get the chance to put my pin, bugs and everything,please fix it developer",NEGATIVE,0.9997047781944275,"Account Access Issues, Feature Requests, User Interface & Experience, Transaction Performance, Customer Support"
I have never seen the worst mobile app like this,NEGATIVE,0.9995693564414978,"Account Access Issues, Feature Requests, User Interface & Experience, Transaction Performance, Customer Support"
Very very good app,POSITIVE,0.9998728036880493,"Account Access Issues, Feature Requests, User Interface & Experience, Transaction Performance, Customer Support"
it keeps crashing,NEGATIVE,0.9201815724372864,"Account Access Issues, Feature Requests, User Interface & Experience, Transaction Performance, Customer Support"
Excited,POSITIVE,0.9997768998146057,"Account Access Issues, Feature Requests, User Interface & Experience, Transaction Performance, Customer Support"
This app isn't working well on Tecno phone 📱. what is the error??,NEGATIVE,0.99974125623703,"Account Access Issues, Feature Requests, User Interface & Experience, Transaction Performance, Customer Support"
👑👑,NEGATIVE,0.6970561146736145,"Account Access Issues, Feature Requests, User Interface & Experience, Transaction Performance, Customer Support"
Bad app,NEGATIVE,0.9997212290763855,"Account Access Issues, Feature Requests, User Interface & Experience, Transaction Performance, Customer Support"
To payment,POSITIVE,0.9512701034545898,"Account Access Issues, Feature Requests, User Interface & Experience, Transaction Performance, Customer Support"
"With every update the app keeps on getting worse,it is filled with bugs",NEGATIVE,0.9996582269668579,"Account Access Issues, Feature Requests, User Interface & Experience, Transaction Performance, Customer Support"
Not working properly why?????????,NEGATIVE,0.999762237071991,"Account Access Issues, Feature Requests, User Interface & Experience, Transaction Performance, Customer Support"
The update app is the worest one when i compare with past.,NEGATIVE,0.9917793869972229,"Account Access Issues, Feature Requests, User Interface & Experience, Transaction Performance, Customer Support"
"It's nice, the stack thing needs update thou",POSITIVE,0.9839306473731995,"Account Access Issues, Feature Requests, User Interface & Experience, Transaction Performance, Customer Support"
This application is relatively good even if some times interpreted.But apolo is difficult application please improve it.,POSITIVE,0.9913715124130249,"Account Access Issues, Feature Requests, User Interface & Experience, Transaction Performance, Customer Support"
The app is not properly working.,NEGATIVE,0.999790370464325,"Account Access Issues, Feature Requests, User Interface & Experience, Transaction Performance, Customer Support"
It is always crushing it loged me out all the time,NEGATIVE,0.9912962913513184,"Account Access Issues, Feature Requests, User Interface & Experience, Transaction Performance, Customer Support"
I love boa but the mobile app isn't as good as the older version when the app gets update it gets worse and worse it doesn't even work..fix the issue with that,NEGATIVE,0.9996931552886963,"Account Access Issues, Feature Requests, User Interface & Experience, Transaction Performance, Customer Support"
"Why Why Why???? it is difficult to make transactions, it takes alot of time to make payments, i thought the update will make it work, but it got worse. please fix it",NEGATIVE,0.9996634721755981,"Account Access Issues, Feature Requests, User Interface & Experience, Transaction Performance, Customer Support"
"the worst app I have ever used, I could've given 5 star if it worked properly even just for logging in and check my accounts. seemed that's impossible",NEGATIVE,0.9998034834861755,"Account Access Issues, Feature Requests, User Interface & Experience, Transaction Performance, Customer Support"
sometime it is not working wel,NEGATIVE,0.9996587038040161,"Account Access Issues, Feature Requests, User Interface & Experience, Transaction Performance, Customer Support"
Very helpfull app,POSITIVE,0.9989476799964905,"Account Access Issues, Feature Requests, User Interface & Experience, Transaction Performance, Customer Support"
Best 100%,POSITIVE,0.9998010993003845,"Account Access Issues, Feature Requests, User Interface & Experience, Transaction Performance, Customer Support"
"Very slow response , try to some updates in the application",NEGATIVE,0.9997745156288147,"Account Access Issues, Feature Requests, User Interface & Experience, Transaction Performance, Customer Support"
BoA,NEGATIVE,0.7410509586334229,"Account Access Issues, Feature Requests, User Interface & Experience, Transaction Performance, Customer Support"
"useless app. bank to bank transactions do not work at all, wallet topups like telebirr take hours to reach. what a shame from a bank this big.",NEGATIVE,0.9997989535331726,"Account Access Issues, Feature Requests, User Interface & Experience, Transaction Performance, Customer Support"
Really work very good app l like you BoA,POSITIVE,0.9998058676719666,"Account Access Issues, Feature Requests, User Interface & Experience, Transaction Performance, Customer Support"
ያምራል,NEGATIVE,0.6970561146736145,"Account Access Issues, Feature Requests, User Interface & Experience, Transaction Performance, Customer Support"
Very old app is disgusting,NEGATIVE,0.9996281862258911,"Account Access Issues, Feature Requests, User Interface & Experience, Transaction Performance, Customer Support"
The worst App I have ever seen.,NEGATIVE,0.9997918009757996,"Account Access Issues, Feature Requests, User Interface & Experience, Transaction Performance, Customer Support"
"I tried it with different phones, it only worked for about a week and then it stopped working. It needs some serious work.",NEGATIVE,0.9994667172431946,"Account Access Issues, Feature Requests, User Interface & Experience, Transaction Performance, Customer Support"
The onky defect is that it is too slow,NEGATIVE,0.9996615648269653,"Account Access Issues, Feature Requests, User Interface & Experience, Transaction Performance, Customer Support"
Sorry to say it is very poor apps I have decided to suspend the BoA account,NEGATIVE,0.9997908473014832,"Account Access Issues, Feature Requests, User Interface & Experience, Transaction Performance, Customer Support"
Boa is the best app but Please Clear Instant or Not instant option of send money be for Asked !!!,NEGATIVE,0.8803104758262634,"Account Access Issues, Feature Requests, User Interface & Experience, Transaction Performance, Customer Support"
"Installed the latest version of this app on my Android 14 device, but it is not working. I have already received the activation key from your branch (via SMS), but couldn't activate it. It is a failed app. I bet you don't have QA testers.",NEGATIVE,0.9996954202651978,"Account Access Issues, Feature Requests, User Interface & Experience, Transaction Performance, Customer Support"
"This is not functional at all, it takes forever to make a transaction,please improve it.",NEGATIVE,0.996469259262085,"Account Access Issues, Feature Requests, User Interface & Experience, Transaction Performance, Customer Support"
Nic app,POSITIVE,0.9797858595848083,"Account Access Issues, Feature Requests, User Interface & Experience, Transaction Performance, Customer Support"
I can't update the enable button not open.,NEGATIVE,0.9989743232727051,"Account Access Issues, Feature Requests, User Interface & Experience, Transaction Performance, Customer Support"
The best,POSITIVE,0.9998332262039185,"Account Access Issues, Feature Requests, User Interface & Experience, Transaction Performance, Customer Support"
The Bank I always love 😘 and work with them is priceless,POSITIVE,0.9997803568840027,"Account Access Issues, Feature Requests, User Interface & Experience, Transaction Performance, Customer Support"
It's the best,POSITIVE,0.9998540878295898,"Account Access Issues, Feature Requests, User Interface & Experience, Transaction Performance, Customer Support"
"BOA app was one of my favourite back in the days, now I don't if there is an app worsen that this.. very very bad. You need to fix it or remove it.",NEGATIVE,0.9997431635856628,"Account Access Issues, Feature Requests, User Interface & Experience, Transaction Performance, Customer Support"
This app is very wonderful,POSITIVE,0.999883770942688,"Account Access Issues, Feature Requests, User Interface & Experience, Transaction Performance, Customer Support"
It is not working at all.,NEGATIVE,0.999782145023346,"Account Access Issues, Feature Requests, User Interface & Experience, Transaction Performance, Customer Support"
To slow,NEGATIVE,0.9994872808456421,"Account Access Issues, Feature Requests, User Interface & Experience, Transaction Performance, Customer Support"
🙏,NEGATIVE,0.6970561146736145,"Account Access Issues, Feature Requests, User Interface & Experience, Transaction Performance, Customer Support"
"I've never seen a very worst mobile banking system like this, i lost 37000 birr because of your delay transaction system, i called 8397 and they told me stay for confirmation but, after i changed my mind and waiting for confirmation call to cancel the process they sent it with out my approval, so please don't use the mobile banking system please",NEGATIVE,0.9995245933532715,"Account Access Issues, Feature Requests, User Interface & Experience, Transaction Performance, Customer Support"
6r---“q##👺,NEGATIVE,0.9579623341560364,"Account Access Issues, Feature Requests, User Interface & Experience, Transaction Performance, Customer Support"
In Ethiopia pest Bank,NEGATIVE,0.9949629306793213,"Account Access Issues, Feature Requests, User Interface & Experience, Transaction Performance, Customer Support"
It is not working,NEGATIVE,0.9997721314430237,"Account Access Issues, Feature Requests, User Interface & Experience, Transaction Performance, Customer Support"
እጅግ በጣም ጥሩ ነው ።,NEGATIVE,0.8832125663757324,"Account Access Issues, Feature Requests, User Interface & Experience, Transaction Performance, Customer Support"
Good,POSITIVE,0.9998161196708679,"Account Access Issues, Feature Requests, User Interface & Experience, Transaction Performance, Customer Support"
Only problem is often it has connectivity issues.,NEGATIVE,0.9959843158721924,"Account Access Issues, Feature Requests, User Interface & Experience, Transaction Performance, Customer Support"
Not bad but please make it lite pls,POSITIVE,0.9990805387496948,"Account Access Issues, Feature Requests, User Interface & Experience, Transaction Performance, Customer Support"
Usfull,POSITIVE,0.9459741115570068,"Account Access Issues, Feature Requests, User Interface & Experience, Transaction Performance, Customer Support"
Good bank,POSITIVE,0.9998420476913452,"Account Access Issues, Feature Requests, User Interface & Experience, Transaction Performance, Customer Support"
"It says ""Something is wrong with your internet banking user, go to your nearest branch"" It hasn't been working since April 13.",NEGATIVE,0.99941086769104,"Account Access Issues, Feature Requests, User Interface & Experience, Transaction Performance, Customer Support"
በጣም ምርጥ አኘ ነው ቶሎ ይበላሻል,NEGATIVE,0.9046947360038757,"Account Access Issues, Feature Requests, User Interface & Experience, Transaction Performance, Customer Support"
I like this bank by his activity and respect castemers i look like my house,POSITIVE,0.9994611144065857,"Account Access Issues, Feature Requests, User Interface & Experience, Transaction Performance, Customer Support"
አርፍ ነው,NEGATIVE,0.7850579619407654,"Account Access Issues, Feature Requests, User Interface & Experience, Transaction Performance, Customer Support"
Bank Of Abyssina,NEGATIVE,0.9958736300468445,"Account Access Issues, Feature Requests, User Interface & Experience, Transaction Performance, Customer Support"
very fast also nice app i love it,POSITIVE,0.9998733997344971,"Account Access Issues, Feature Requests, User Interface & Experience, Transaction Performance, Customer Support"
በጣም አስቸጋሪ እና አዳጋች የሆነ አሠራር ነው የሚጠቀመው ግብይት መፈፀም ክፍያው ተቆርጦ ሎክ አካውንት በማለት ያስቀምጣል በሌላ አማራጭ ከከፈሉ በኃላ ተመላሽ እንኳን አያደርግም,NEGATIVE,0.9615163207054138,"Account Access Issues, Feature Requests, User Interface & Experience, Transaction Performance, Customer Support"
"By far the nicest looking app by an Ethiopian Bank. But it's functionality is weak. It is full of Transaction error, Function Error. Kudos, but it needs more backend work.",NEGATIVE,0.9993565678596497,"Account Access Issues, Feature Requests, User Interface & Experience, Transaction Performance, Customer Support"
Very bad 👎,NEGATIVE,0.9998021721839905,"Account Access Issues, Feature Requests, User Interface & Experience, Transaction Performance, Customer Support"
Not reliable always with some issues,NEGATIVE,0.9995911717414856,"Account Access Issues, Feature Requests, User Interface & Experience, Transaction Performance, Customer Support"
Right one,POSITIVE,0.9998385906219482,"Account Access Issues, Feature Requests, User Interface & Experience, Transaction Performance, Customer Support"
"So BoA, your last application was horrible and buggy. And we thought ""finally!! a functional new app with better UI."" But It didn't last long, a non existent connection error at login.... Please just fix your app to the simplest functional form and it would be up to your other service standards.",NEGATIVE,0.9980742931365967,"Account Access Issues, Feature Requests, User Interface & Experience, Transaction Performance, Customer Support"
"It has good backgroud and simple. But keeps saying no conectivty , login, Close immediately you made it porly not woriking on stable network!!!",NEGATIVE,0.7382310628890991,"Account Access Issues, Feature Requests, User Interface & Experience, Transaction Performance, Customer Support"
"It was working fine a couple of days ago, in the utilities section of payment it only provides a few services but that is OK for now but my issue is it has started crashing down these past 2 days",NEGATIVE,0.9992096424102783,"Account Access Issues, Feature Requests, User Interface & Experience, Transaction Performance, Customer Support"
"This app is awesome, I like the features",POSITIVE,0.9998729228973389,"Account Access Issues, Feature Requests, User Interface & Experience, Transaction Performance, Customer Support"
"The app is a total waste of time, it glitches, doesn't log in fast, super slow.",NEGATIVE,0.9996176958084106,"Account Access Issues, Feature Requests, User Interface & Experience, Transaction Performance, Customer Support"
Very very bad app,NEGATIVE,0.9997959733009338,"Account Access Issues, Feature Requests, User Interface & Experience, Transaction Performance, Customer Support"
Not work this app ...what is the problem,NEGATIVE,0.9997695088386536,"Account Access Issues, Feature Requests, User Interface & Experience, Transaction Performance, Customer Support"
the new updated app exception handling for connection fluctuations is so exhausting which lead users to login repeated times.,NEGATIVE,0.9997285008430481,"Account Access Issues, Feature Requests, User Interface & Experience, Transaction Performance, Customer Support"
"Some problem this app,",NEGATIVE,0.9994459748268127,"Account Access Issues, Feature Requests, User Interface & Experience, Transaction Performance, Customer Support"
It keeps on crashing,NEGATIVE,0.5192270874977112,"Account Access Issues, Feature Requests, User Interface & Experience, Transaction Performance, Customer Support"
poor performance,NEGATIVE,0.999767005443573,"Account Access Issues, Feature Requests, User Interface & Experience, Transaction Performance, Customer Support"
Hey no working,NEGATIVE,0.9963237047195435,"Account Access Issues, Feature Requests, User Interface & Experience, Transaction Performance, Customer Support"
It's good app tnx for u new update it's very easy to using this app they add some future tnx Abyssinia bank,POSITIVE,0.996093213558197,"Account Access Issues, Feature Requests, User Interface & Experience, Transaction Performance, Customer Support"
A lot of the app's features have been rearranged but sometimes it works sometimes it doesnt...and that makes it less reliable specially at times of need...pls improve it,NEGATIVE,0.9991328120231628,"Account Access Issues, Feature Requests, User Interface & Experience, Transaction Performance, Customer Support"
Now am confused upgrade or downgrade 🤔,NEGATIVE,0.9976465106010437,"Account Access Issues, Feature Requests, User Interface & Experience, Transaction Performance, Customer Support"
Wowww,POSITIVE,0.9972698092460632,"Account Access Issues, Feature Requests, User Interface & Experience, Transaction Performance, Customer Support"
wow good job BOA,POSITIVE,0.9998181462287903,"Account Access Issues, Feature Requests, User Interface & Experience, Transaction Performance, Customer Support"
Vary good app,POSITIVE,0.9998146891593933,"Account Access Issues, Feature Requests, User Interface & Experience, Transaction Performance, Customer Support"
Can you please just make it functional. I don't think anyone cares how good it looks if not a single functionality works. Plus it's not even aestheticaly nice. The loading animated icon has white irregular edges because the logo wasn't cut out correctly. The app doesn't work at all. It doesn't even login. It gets stuck on login just showing the logo animation and blames the issue on connectivity. Connectivity is fine and the proof is that this review is posted.,NEGATIVE,0.7783335447311401,"Account Access Issues, Feature Requests, User Interface & Experience, Transaction Performance, Customer Support"
add receipt pdf like telebirr,NEGATIVE,0.9775200486183167,"Account Access Issues, Feature Requests, User Interface & Experience, Transaction Performance, Customer Support"
በጣም ቀለል ያለ እና ምቹ ና አስተማማኝ ነው እርሶም ይጠቀሙበት !!!,POSITIVE,0.9787023067474365,"Account Access Issues, Feature Requests, User Interface & Experience, Transaction Performance, Customer Support"
The best,POSITIVE,0.9998332262039185,"Account Access Issues, Feature Requests, User Interface & Experience, Transaction Performance, Customer Support"
The app is not showing my balance or any transaction it is like corrupted showing usd amounts,NEGATIVE,0.999426007270813,"Account Access Issues, Feature Requests, User Interface & Experience, Transaction Performance, Customer Support"
አሰ,NEGATIVE,0.6970561146736145,"Account Access Issues, Feature Requests, User Interface & Experience, Transaction Performance, Customer Support"
Its good,POSITIVE,0.9998385906219482,"Account Access Issues, Feature Requests, User Interface & Experience, Transaction Performance, Customer Support"
❤,NEGATIVE,0.6970561146736145,"Account Access Issues, Feature Requests, User Interface & Experience, Transaction Performance, Customer Support"
it's so slow app please fix it,NEGATIVE,0.9994977712631226,"Account Access Issues, Feature Requests, User Interface & Experience, Transaction Performance, Customer Support"
It crash always,NEGATIVE,0.9991788268089294,"Account Access Issues, Feature Requests, User Interface & Experience, Transaction Performance, Customer Support"
The most terrible mobel banking app in the world it is not working ones in a week,NEGATIVE,0.9983479976654053,"Account Access Issues, Feature Requests, User Interface & Experience, Transaction Performance, Customer Support"
"Ultimately, the worst mobile banking experience ever left me feeling exasperated and disillusioned.Its a nightmare",NEGATIVE,0.9998087286949158,"Account Access Issues, Feature Requests, User Interface & Experience, Transaction Performance, Customer Support"
"The updated version of this app is just time wasting. It doesn't work with 2G/3G network.require log in frequently,not fast as much as possible.automatic log out are the bad features of this app",NEGATIVE,0.9997401833534241,"Account Access Issues, Feature Requests, User Interface & Experience, Transaction Performance, Customer Support"
Why u do that hh,NEGATIVE,0.9960595369338989,"Account Access Issues, Feature Requests, User Interface & Experience, Transaction Performance, Customer Support"
Abissiniya bank one of the best for giving the future,POSITIVE,0.9998038411140442,"Account Access Issues, Feature Requests, User Interface & Experience, Transaction Performance, Customer Support"
This the best mobile banking App BOA mobile banking included all digital banking features and we can access the most companies and sectors with this App. Thanks for giving this services Keep going .,POSITIVE,0.9996832609176636,"Account Access Issues, Feature Requests, User Interface & Experience, Transaction Performance, Customer Support"
"This has to be your worst app ever, damm so many bugs and it lags so baddd. Please fix it",NEGATIVE,0.9998080134391785,"Account Access Issues, Feature Requests, User Interface & Experience, Transaction Performance, Customer Support"
Simplify your life by using the Abyssinia app I like it because it is comfortable and safe,POSITIVE,0.9996391534805298,"Account Access Issues, Feature Requests, User Interface & Experience, Transaction Performance, Customer Support"
"General, when I considered from other banks, this bank is unique",POSITIVE,0.9998138546943665,"Account Access Issues, Feature Requests, User Interface & Experience, Transaction Performance, Customer Support"
Boa ... The best,POSITIVE,0.9998708963394165,"Account Access Issues, Feature Requests, User Interface & Experience, Transaction Performance, Customer Support"
wow its so attractive,POSITIVE,0.9998676776885986,"Account Access Issues, Feature Requests, User Interface & Experience, Transaction Performance, Customer Support"
Yet another useless app,NEGATIVE,0.9997926354408264,"Account Access Issues, Feature Requests, User Interface & Experience, Transaction Performance, Customer Support"
Keep it up 1ygna bank,POSITIVE,0.9989239573478699,"Account Access Issues, Feature Requests, User Interface & Experience, Transaction Performance, Customer Support"
It's good!,POSITIVE,0.9998363256454468,"Account Access Issues, Feature Requests, User Interface & Experience, Transaction Performance, Customer Support"
oh,POSITIVE,0.9806591272354126,"Account Access Issues, Feature Requests, User Interface & Experience, Transaction Performance, Customer Support"
Great apps,POSITIVE,0.9998534917831421,"Account Access Issues, Feature Requests, User Interface & Experience, Transaction Performance, Customer Support"
It closes playing audio app when it is opened . What is the solution?,NEGATIVE,0.9949249029159546,"Account Access Issues, Feature Requests, User Interface & Experience, Transaction Performance, Customer Support"
